02:21:58  INFO      Loaded active universe: 1915 tickers from active_universe.json
INFO:     Started server process [74156]
INFO:     Waiting for application startup.
02:21:58  INFO      SQLite DB initialised at trading.db
INFO:     Application startup complete.
INFO:     Uvicorn running on http://0.0.0.0:8001 (Press CTRL+C to quit)
INFO:     127.0.0.1:53236 - "GET /api/chart/OS HTTP/1.1" 200 OK
INFO:     127.0.0.1:54635 - "GET /api/chart/OS HTTP/1.1" 200 OK
INFO:     127.0.0.1:54660 - "GET /api/health HTTP/1.1" 200 OK
INFO:     127.0.0.1:54674 - "POST /api/run-scan HTTP/1.1" 200 OK
02:22:08  INFO      \u25b6 Scan started  ts=2026-02-22T00:22:08  tickers=1915
02:22:08  INFO      Engine 0: BULLISH  (SPY=689.43  EMA20=687.61)  [0.3s]
02:22:09  INFO      SPY data fetched: 502 days for RS Line
02:22:09  INFO      SPY 3-month return: 4.76%
02:22:09  INFO      SPY fetch completed  [0.2s]
02:22:10  INFO        NEAR     ABBV    dist=0.8%
02:22:10  INFO        NEAR     ACM     dist=1.4%
02:22:13  INFO        NEAR     AMBA    dist=1.1%
02:22:16  INFO        PULLBACK ARI     entry=10.66 (relaxed)
02:22:22  INFO        BASE     BKV     CUP_HANDLE  Q=56  entry=31.53
02:22:22  INFO        PULLBACK BNTX    entry=111.00 (relaxed)
02:22:22  INFO        NEAR     BSY     dist=0.4%
02:22:23  INFO        NEAR     BV      dist=0.7%
02:22:23  INFO        NEAR     BXP     dist=0.1%
02:22:24  INFO        PULLBACK BXMT    entry=19.57 (relaxed)
02:22:25  INFO        NEAR     CBT     dist=1.1%
02:22:26  INFO        NEAR     CHA     dist=1.0%
02:22:27  INFO        VCP      CMS     entry=76.54
02:22:28  INFO        NEAR     CNTA    dist=0.5%
02:22:28  INFO        NEAR     COLD    dist=0.4%
02:22:28  INFO        PULLBACK CNM     entry=57.55 (relaxed)
02:22:29  INFO        NEAR     COGT    dist=1.4%
02:22:29  INFO        NEAR     CPT     dist=1.4%
02:22:31  INFO        NEAR     CUK     dist=0.5%
02:22:32  INFO        NEAR     DEC     dist=1.2%
02:22:34  INFO        NEAR     DOC     dist=1.2%
02:22:36  INFO        PULLBACK EDU     entry=60.69 (relaxed)
02:22:38  INFO        NEAR     ETHA    dist=0.1%
02:22:38  INFO        NEAR     ETH     dist=0.6%
02:22:38  INFO        NEAR     ETHE    dist=0.2%
02:22:39  INFO        NEAR     EXE     dist=0.2%
02:22:41  INFO        PULLBACK FFIN    entry=33.74 (relaxed)
02:22:42  INFO        PULLBACK FOXF    entry=20.02 (relaxed)
02:22:42  INFO        BASE     FOLD    FLAT_BASE  Q=42  entry=14.39
02:22:43  INFO        NEAR     FWONK   dist=0.6%
02:22:43  INFO        NEAR     FWRD    dist=1.1%
02:22:44  INFO        PULLBACK GBCI    entry=50.73 (relaxed)
02:22:45  INFO        NEAR     GMAB    dist=0.7%
02:22:45  INFO        NEAR     GOOD    dist=1.3%
02:22:48  INFO        NEAR     HMC     dist=0.6%
02:22:48  INFO        PULLBACK HD      entry=385.20 (relaxed)
02:22:49  INFO        PULLBACK HOMB    entry=29.46 (relaxed)
02:22:50  INFO        NEAR     IAC     dist=1.1%
02:22:50  INFO        NEAR     IBN     dist=0.7%
02:22:50  INFO        NEAR     IDYA    dist=1.5%
02:22:51  INFO        PULLBACK IBKR    entry=74.82 (relaxed)
02:22:52  INFO        PULLBACK INGR    entry=117.58 (relaxed)
02:22:54  INFO        NEAR     KDP     dist=0.6%
02:22:56  INFO        NEAR     LADR    dist=0.8%
02:22:56  INFO        NEAR     LAMR    dist=0.2%
02:22:58  INFO        PULLBACK LKQ     entry=34.19 (relaxed)
02:22:59  INFO        PULLBACK LTH     entry=29.34 (relaxed)
02:22:59  INFO        PULLBACK MAMA    entry=15.97
02:23:00  INFO        PULLBACK MCHB    entry=15.50 (relaxed)
02:23:01  INFO        NEAR     MKC     dist=1.4%
02:23:01  INFO        NEAR     MNSO    dist=0.2%
02:23:03  INFO        NEAR     MTG     dist=1.3%
02:23:03  INFO        NEAR     NCLH    dist=0.3%
02:23:07  INFO        NEAR     NVDA    dist=0.3%
02:23:09  INFO        NEAR     ORLY    dist=0.7%
02:23:09  INFO        VCP      OTIS    entry=94.66
02:23:10  INFO        BASE     OS      FLAT_BASE  Q=34  entry=23.70
02:23:12  INFO        BASE     PBR     CUP_HANDLE  Q=28  entry=15.85
02:23:12  INFO        BASE     PBR-A   CUP_HANDLE  Q=27  entry=14.77
02:23:13  INFO        VCP      PPL     entry=37.88
02:23:14  INFO        PULLBACK POWI    entry=46.64 (relaxed)
02:23:15  INFO        PULLBACK PRMB    entry=18.83 (relaxed)
02:23:15  INFO        NEAR     RAL     dist=1.5%
02:23:17  INFO        NEAR     RDN     dist=0.8%
02:23:19  INFO        PULLBACK RMD     entry=259.46 (relaxed)
02:23:21  INFO        PULLBACK SBH     entry=16.09 (relaxed)
02:23:21  INFO        PULLBACK SBUX    entry=97.88 (relaxed)
02:23:24  INFO        NEAR     SO      dist=0.7%
02:23:24  INFO        PULLBACK SNX     entry=165.72 (relaxed)
INFO:     127.0.0.1:53789 - "GET /api/scan-status HTTP/1.1" 200 OK
02:23:30  INFO        NEAR     TSLA    dist=1.3%
02:23:30  INFO        PULLBACK TREX    entry=43.01 (relaxed)
02:23:32  INFO        NEAR     ULS     dist=1.0%
02:23:32  INFO        PULLBACK UCB     entry=34.91
02:23:33  INFO        PULLBACK UMBF    entry=127.75 (relaxed)
02:23:33  INFO        NEAR     VICI    dist=0.6%
02:23:34  INFO        PULLBACK VISN    entry=19.32 (relaxed)
02:23:35  INFO        NEAR     VRSN    dist=0.9%
02:23:36  INFO        PULLBACK VRTX    entry=479.60 (relaxed)
02:23:38  INFO        NEAR     WSC     dist=1.0%
02:23:38  INFO        NEAR     WTRG    dist=1.2%
02:23:39  INFO        BASE     XHR     FLAT_BASE  Q=41  entry=16.12
02:23:39  INFO      Per-ticker processing completed  [90.9s]  vcp=3  pb=27  base=6  total_setups=81
02:23:39  INFO      Batch saved 81 setups to database  [0.0s]
02:23:39  INFO      \u2550\u2550\u2550\u2550\u2550\u2550\u2550\u2550\u2550\u2550\u2550\u2550\u2550\u2550\u2550\u2550\u2550\u2550\u2550\u2550\u2550\u2550\u2550\u2550\u2550\u2550\u2550\u2550\u2550\u2550\u2550\u2550\u2550\u2550\u2550\u2550\u2550\u2550\u2550\u2550\u2550\u2550\u2550\u2550\u2550\u2550\u2550\u2550\u2550\u2550\u2550\u2550\u2550\u2550\u2550\u2550\u2550
02:23:39  INFO      SECTOR SUMMARY — INSTITUTIONAL ROTATION ALERT
02:23:39  INFO      \u2550\u2550\u2550\u2550\u2550\u2550\u2550\u2550\u2550\u2550\u2550\u2550\u2550\u2550\u2550\u2550\u2550\u2550\u2550\u2550\u2550\u2550\u2550\u2550\u2550\u2550\u2550\u2550\u2550\u2550\u2550\u2550\u2550\u2550\u2550\u2550\u2550\u2550\u2550\u2550\u2550\u2550\u2550\u2550\u2550\u2550\u2550\u2550\u2550\u2550\u2550\u2550\u2550\u2550\u2550\u2550\u2550
02:23:39  INFO      \u2550\u2550\u2550\u2550\u2550\u2550\u2550\u2550\u2550\u2550\u2550\u2550\u2550\u2550\u2550\u2550\u2550\u2550\u2550\u2550\u2550\u2550\u2550\u2550\u2550\u2550\u2550\u2550\u2550\u2550\u2550\u2550\u2550\u2550\u2550\u2550\u2550\u2550\u2550\u2550\u2550\u2550\u2550\u2550\u2550\u2550\u2550\u2550\u2550\u2550\u2550\u2550\u2550\u2550\u2550\u2550\u2550
02:23:39  INFO      \u2713 DATA QUALITY: All 1915 tickers processed successfully (0 dropped)
02:23:39  INFO      \u2714 Scan complete  VCP=3  Pullbacks=27  Processed=1915/1915  Total=91.4s  (Regime=0.3s, SPY=0.2s, Process=90.9s)
INFO:     127.0.0.1:51301 - "GET /api/chart/RAL HTTP/1.1" 200 OK
INFO:     127.0.0.1:54547 - "GET /api/scan-status HTTP/1.1" 200 OK
INFO:     127.0.0.1:54844 - "GET /api/setups HTTP/1.1" 200 OK
INFO:     127.0.0.1:54214 - "GET /api/chart/IDYA HTTP/1.1" 200 OK
